{"contract":"typaxis.matterhorn-assessment/2","fixture":{"fixture_id":"mi4-v19.production-readiness","revision_sha256":"63f4424b23faaac2e66f5227a63f22838004913c065508f56461453f9c9e0505"},"items":[{"evidence":"closed-fixture-feature-inventory","id":"01-001","method":"human","rationale":"fixture_contains_no_artifact_marked_content","status":"not_applicable"},{"evidence":"closed-fixture-feature-inventory","id":"01-002","method":"human","rationale":"fixture_contains_no_artifact_marked_content","status":"not_applicable"},{"evidence":"verapdf-ua1-and-independent-structure-v2","id":"01-003","method":"machine","rationale":"pinned_pdfua_machine_validation_passed","status":"passed"},{"evidence":"verapdf-ua1-and-independent-structure-v2","id":"01-004","method":"machine","rationale":"pinned_pdfua_machine_validation_passed","status":"passed"},{"evidence":"verapdf-ua1-and-independent-structure-v2","id":"01-005","method":"machine","rationale":"pinned_pdfua_machine_validation_passed","status":"passed"},{"evidence":"manual-semantic-review","id":"01-006","method":"human","rationale":"manual_semantic_role_review","status":"passed"},{"evidence":"verapdf-ua1-and-independent-structure-v2","id":"02-001","method":"machine","rationale":"pinned_pdfua_machine_validation_passed","status":"passed"},{"evidence":"closed-fixture-feature-inventory","id":"02-002","method":"human","rationale":"fixture_contains_no_custom_role_mapping","status":"not_applicable"},{"evidence":"verapdf-ua1-and-independent-structure-v2","id":"02-003","method":"machine","rationale":"pinned_pdfua_machine_validation_passed","status":"passed"},{"evidence":"verapdf-ua1-and-independent-structure-v2","id":"02-004","method":"machine","rationale":"pinned_pdfua_machine_validation_passed","status":"passed"},{"evidence":"closed-fixture-feature-inventory","id":"03-001","method":"human","rationale":"fixture_contains_no_action_multimedia_or_javascript","status":"not_applicable"},{"evidence":"closed-fixture-feature-inventory","id":"03-002","method":"human","rationale":"fixture_contains_no_action_multimedia_or_javascript","status":"not_applicable"},{"evidence":"closed-fixture-feature-inventory","id":"03-003","method":"human","rationale":"fixture_contains_no_action_multimedia_or_javascript","status":"not_applicable"},{"evidence":"closed-fixture-feature-inventory","id":"04-001","method":"human","rationale":"fixture_conveys_no_semantics_by_color_or_layout_alone","status":"not_applicable"},{"evidence":"closed-fixture-feature-inventory","id":"05-001","method":"human","rationale":"fixture_contains_no_audio_or_javascript_notification","status":"not_applicable"},{"evidence":"closed-fixture-feature-inventory","id":"05-002","method":"human","rationale":"fixture_contains_no_audio_or_javascript_notification","status":"not_applicable"},{"evidence":"closed-fixture-feature-inventory","id":"05-003","method":"human","rationale":"fixture_contains_no_audio_or_javascript_notification","status":"not_applicable"},{"evidence":"verapdf-ua1-and-independent-structure-v2","id":"06-001","method":"machine","rationale":"pinned_pdfua_machine_validation_passed","status":"passed"},{"evidence":"verapdf-ua1-and-independent-structure-v2","id":"06-002","method":"machine","rationale":"pinned_pdfua_machine_validation_passed","status":"passed"},{"evidence":"verapdf-ua1-and-independent-structure-v2","id":"06-003","method":"machine","rationale":"pinned_pdfua_machine_validation_passed","status":"passed"},{"evidence":"manual-semantic-review","id":"06-004","method":"human","rationale":"manual_title_metadata_review","status":"passed"},{"evidence":"verapdf-ua1-and-independent-structure-v2","id":"07-001","method":"machine","rationale":"pinned_pdfua_machine_validation_passed","status":"passed"},{"evidence":"verapdf-ua1-and-independent-structure-v2","id":"07-002","method":"machine","rationale":"pinned_pdfua_machine_validation_passed","status":"passed"},{"evidence":"closed-fixture-feature-inventory","id":"08-001","method":"human","rationale":"fixture_contains_no_ocr_content","status":"not_applicable"},{"evidence":"closed-fixture-feature-inventory","id":"08-002","method":"human","rationale":"fixture_contains_no_ocr_content","status":"not_applicable"},{"evidence":"verapdf-ua1-and-independent-structure-v2","id":"08-003","method":"machine","rationale":"pinned_pdfua_machine_validation_passed","status":"passed"},{"evidence":"manual-semantic-review","id":"09-001","method":"human","rationale":"manual_logical_reading_order_review","status":"passed"},{"evidence":"manual-semantic-review","id":"09-002","method":"human","rationale":"manual_structure_nesting_review","status":"passed"},{"evidence":"manual-semantic-review","id":"09-003","method":"human","rationale":"manual_semantic_role_review","status":"passed"},{"evidence":"verapdf-ua1-and-independent-structure-v2","id":"09-004","method":"machine","rationale":"pinned_pdfua_machine_validation_passed","status":"passed"},{"evidence":"verapdf-ua1-and-independent-structure-v2","id":"09-005","method":"machine","rationale":"pinned_pdfua_machine_validation_passed","status":"passed"},{"evidence":"verapdf-ua1-and-independent-structure-v2","id":"09-006","method":"machine","rationale":"pinned_pdfua_machine_validation_passed","status":"passed"},{"evidence":"verapdf-ua1-and-independent-structure-v2","id":"09-007","method":"machine","rationale":"pinned_pdfua_machine_validation_passed","status":"passed"},{"evidence":"verapdf-ua1-and-independent-structure-v2","id":"09-008","method":"machine","rationale":"pinned_pdfua_machine_validation_passed","status":"passed"},{"evidence":"verapdf-ua1-and-independent-structure-v2","id":"10-001","method":"machine","rationale":"pinned_pdfua_machine_validation_passed","status":"passed"},{"evidence":"verapdf-ua1-and-independent-structure-v2","id":"11-001","method":"machine","rationale":"pinned_pdfua_machine_validation_passed","status":"passed"},{"evidence":"verapdf-ua1-and-independent-structure-v2","id":"11-002","method":"machine","rationale":"pinned_pdfua_machine_validation_passed","status":"passed"},{"evidence":"verapdf-ua1-and-independent-structure-v2","id":"11-003","method":"machine","rationale":"pinned_pdfua_machine_validation_passed","status":"passed"},{"evidence":"verapdf-ua1-and-independent-structure-v2","id":"11-004","method":"machine","rationale":"pinned_pdfua_machine_validation_passed","status":"passed"},{"evidence":"verapdf-ua1-and-independent-structure-v2","id":"11-005","method":"machine","rationale":"pinned_pdfua_machine_validation_passed","status":"passed"},{"evidence":"verapdf-ua1-and-independent-structure-v2","id":"11-006","method":"machine","rationale":"pinned_pdfua_machine_validation_passed","status":"passed"},{"evidence":"manual-semantic-review","id":"11-007","method":"human","rationale":"manual_natural_language_review","status":"passed"},{"evidence":"closed-fixture-feature-inventory","id":"12-001","method":"human","rationale":"fixture_contains_no_stretched_character_content","status":"not_applicable"},{"evidence":"manual-semantic-review","id":"13-001","method":"human","rationale":"manual_figure_tag_review","status":"passed"},{"evidence":"closed-fixture-feature-inventory","id":"13-002","method":"human","rationale":"fixture_contains_no_caption_or_meaningful_link_background","status":"not_applicable"},{"evidence":"closed-fixture-feature-inventory","id":"13-003","method":"human","rationale":"fixture_contains_no_caption_or_meaningful_link_background","status":"not_applicable"},{"evidence":"verapdf-ua1-and-independent-structure-v2","id":"13-004","method":"machine","rationale":"pinned_pdfua_machine_validation_passed","status":"passed"},{"evidence":"manual-semantic-review","id":"13-005","method":"human","rationale":"manual_figure_alt_vs_actualtext_review","status":"passed"},{"evidence":"manual-semantic-review","id":"13-006","method":"human","rationale":"manual_graphics_grouping_review","status":"passed"},{"evidence":"manual-semantic-review","id":"13-007","method":"human","rationale":"manual_accessible_representation_review","status":"passed"},{"evidence":"closed-fixture-feature-inventory","id":"14-001","method":"human","rationale":"fixture_contains_no_heading_content","status":"not_applicable"},{"evidence":"verapdf-ua1-and-independent-structure-v2","id":"14-002","method":"machine","rationale":"pinned_pdfua_machine_validation_passed","status":"passed"},{"evidence":"verapdf-ua1-and-independent-structure-v2","id":"14-003","method":"machine","rationale":"pinned_pdfua_machine_validation_passed","status":"passed"},{"evidence":"closed-fixture-feature-inventory","id":"14-004","method":"human","rationale":"fixture_contains_no_heading_content","status":"not_applicable"},{"evidence":"closed-fixture-feature-inventory","id":"14-005","method":"human","rationale":"fixture_contains_no_heading_content","status":"not_applicable"},{"evidence":"verapdf-ua1-and-independent-structure-v2","id":"14-006","method":"machine","rationale":"pinned_pdfua_machine_validation_passed","status":"passed"},{"evidence":"verapdf-ua1-and-independent-structure-v2","id":"14-007","method":"machine","rationale":"pinned_pdfua_machine_validation_passed","status":"passed"},{"evidence":"closed-fixture-feature-inventory","id":"15-001","method":"human","rationale":"fixture_contains_no_table_content","status":"not_applicable"},{"evidence":"closed-fixture-feature-inventory","id":"15-002","method":"human","rationale":"fixture_contains_no_table_content","status":"not_applicable"},{"evidence":"verapdf-ua1-and-independent-structure-v2","id":"15-003","method":"machine","rationale":"pinned_pdfua_machine_validation_passed","status":"passed"},{"evidence":"closed-fixture-feature-inventory","id":"15-004","method":"human","rationale":"fixture_contains_no_table_content","status":"not_applicable"},{"evidence":"closed-fixture-feature-inventory","id":"15-005","method":"human","rationale":"fixture_contains_no_table_content","status":"not_applicable"},{"evidence":"closed-fixture-feature-inventory","id":"16-001","method":"human","rational